{
  "page_id": "pg_camping_marketplace",
  "url": "https://market.example/dp/B0CAMPFAN1",
  "canonical_url": "https://market.example/dp/B0CAMPFAN1",
  "domain": "market.example",
  "fetched_at": "2026-07-21T12:00:00Z",
  "published_at": null,
  "title": "FlexBreeze Pro Rechargeable Camping Fan - 8 inch",
  "author": null,
  "text_md": "# FlexBreeze Pro Rechargeable Camping Fan\n\n$34.99 · 4.1/5 from 1,842 ratings. Reviews cite optimistic battery claims and motor noise in tents.",
  "links": [],
  "media": [],
  "platform_fields": {
    "source_class": "marketplace_listing",
    "asin": "B0CAMPFAN1",
    "rating_count": 1842,
    "price_usd": 34.99
  },
  "content_hash": "sha256:3333333333333333333333333333333333333333333333333333333333333333",
  "token_count": 96,
  "derived_from": ["tsk_camping_fetch_marketplace"],
  "provenance": {
    "code_version": "extract-1.0.0",
    "schema_version": "page.v1",
    "config_hash": "sha256:aaaaaaaaaaaaaaaaaaaaaaaaaaaaaaaaaaaaaaaaaaaaaaaaaaaaaaaaaaaaaaaa",
    "created_at": "2026-07-21T12:00:00Z"
  },
  "schema_version": "page.v1"
}
