{
  "page_id": "pg_camping_review",
  "url": "https://trustcamp.example/review/flexbreeze-pro",
  "canonical_url": "https://trustcamp.example/review/flexbreeze-pro",
  "domain": "trustcamp.example",
  "fetched_at": "2026-07-21T12:00:00Z",
  "published_at": "2026-06-10T11:00:00Z",
  "title": "FlexBreeze Pro Portable Camping Fan Reviews",
  "author": "TrustCamp Reviews",
  "text_md": "# FlexBreeze Pro Portable Camping Fan\n\nTrustScore 3.8 from 214 verified reviews. Top themes: battery life, motor noise, clip mount slipping.",
  "links": [],
  "media": [],
  "platform_fields": {"source_class": "review_page", "review_count": 214},
  "content_hash": "sha256:4444444444444444444444444444444444444444444444444444444444444444",
  "token_count": 120,
  "derived_from": ["tsk_camping_fetch_review"],
  "provenance": {
    "code_version": "extract-1.0.0",
    "schema_version": "page.v1",
    "config_hash": "sha256:aaaaaaaaaaaaaaaaaaaaaaaaaaaaaaaaaaaaaaaaaaaaaaaaaaaaaaaaaaaaaaaa",
    "created_at": "2026-07-21T12:00:00Z"
  },
  "schema_version": "page.v1"
}
