{
  "page_id": "pg_camping_article",
  "url": "https://trailgearlab.example/articles/portable-camping-fans",
  "canonical_url": "https://trailgearlab.example/articles/portable-camping-fans",
  "domain": "trailgearlab.example",
  "fetched_at": "2026-07-21T12:00:00Z",
  "published_at": "2026-07-01T08:00:00Z",
  "title": "Best Portable Camping Fans for Hot Summer Nights",
  "author": "Maya Chen",
  "text_md": "# Best Portable Camping Fans for Hot Summer Nights\n\nBackpackers and car campers alike are searching for compact fans that move enough air without draining a power bank before sunrise. Reader surveys highlight battery life and clip stability as the top friction points.",
  "links": ["https://trailgearlab.example/categories/cooling"],
  "media": [],
  "platform_fields": {"source_class": "article", "word_count": 186},
  "content_hash": "sha256:1111111111111111111111111111111111111111111111111111111111111111",
  "token_count": 186,
  "derived_from": ["tsk_camping_fetch_article"],
  "provenance": {
    "code_version": "extract-1.0.0",
    "schema_version": "page.v1",
    "config_hash": "sha256:aaaaaaaaaaaaaaaaaaaaaaaaaaaaaaaaaaaaaaaaaaaaaaaaaaaaaaaaaaaaaaaa",
    "created_at": "2026-07-21T12:00:00Z"
  },
  "schema_version": "page.v1"
}
